root@lamp-ubuntu-s-1vcpu-1gb-tor1-01:~# tcpdump -i eth0 port 22 -c 10
tcpdump: verbose output suppressed, use -v[v]... for full protocol decode
listening on eth0, link-type EN10MB (Ethernet), snapshot length 262144 bytes
19:18:08.091626 IP lamp-ubuntu-s-1vcpu-1gb-tor1-01.ssh > 198.96.87.225.57001: Flags [P.], seq 3477948595:3477948703, ack 3784657393, win 501, length 108
19:18:08.091696 IP lamp-ubuntu-s-1vcpu-1gb-tor1-01.ssh > 198.96.87.225.57001: Flags [P.], seq 108:144, ack 1, win 501, length 36
19:18:08.091735 IP lamp-ubuntu-s-1vcpu-1gb-tor1-01.ssh > 198.96.87.225.57001: Flags [P.], seq 144:196, ack 1, win 501, length 52
19:18:08.091770 IP lamp-ubuntu-s-1vcpu-1gb-tor1-01.ssh > 198.96.87.225.57001: Flags [P.], seq 196:264, ack 1, win 501, length 68
19:18:08.091802 IP lamp-ubuntu-s-1vcpu-1gb-tor1-01.ssh > 198.96.87.225.57001: Flags [P.], seq 264:332, ack 1, win 501, length 68
19:18:08.091833 IP lamp-ubuntu-s-1vcpu-1gb-tor1-01.ssh > 198.96.87.225.57001: Flags [P.], seq 332:368, ack 1, win 501, length 36
19:18:08.097150 IP 198.96.87.225.57001 > lamp-ubuntu-s-1vcpu-1gb-tor1-01.ssh: Flags [.], ack 368, win 2050, length 0
19:18:08.196280 IP lamp-ubuntu-s-1vcpu-1gb-tor1-01.ssh > 198.96.87.225.57001: Flags [P.], seq 368:556, ack 1, win 501, length 188
19:18:08.196354 IP lamp-ubuntu-s-1vcpu-1gb-tor1-01.ssh > 198.96.87.225.57001: Flags [P.], seq 556:592, ack 1, win 501, length 36
19:18:08.196404 IP lamp-ubuntu-s-1vcpu-1gb-tor1-01.ssh > 198.96.87.225.57001: Flags [P.], seq 592:756, ack 1, win 501, length 164
10 packets captured
28 packets received by filter
0 packets dropped by kernel
