root@lamp-ubuntu-s-1vcpu-1gb-tor1-01:~# tcpdump -i eth0
tcpdump: verbose output suppressed, use -v[v]... for full protocol decode
listening on eth0, link-type EN10MB (Ethernet), snapshot length 262144 bytes
18:52:36.968359 IP lamp-ubuntu-s-1vcpu-1gb-tor1-01.ssh > 198.96.87.225.57001: Flags [P.], seq 3470084439:3470084547, ack 3784644513, win 501, length 108
18:52:36.968460 IP lamp-ubuntu-s-1vcpu-1gb-tor1-01.ssh > 198.96.87.225.57001: Flags [P.], seq 108:144, ack 1, win 501, length 36
18:52:36.968498 IP lamp-ubuntu-s-1vcpu-1gb-tor1-01.ssh > 198.96.87.225.57001: Flags [P.], seq 144:196, ack 1, win 501, length 52
18:52:36.968532 IP lamp-ubuntu-s-1vcpu-1gb-tor1-01.ssh > 198.96.87.225.57001: Flags [P.], seq 196:264, ack 1, win 501, length 68
18:52:36.968589 IP lamp-ubuntu-s-1vcpu-1gb-tor1-01.ssh > 198.96.87.225.57001: Flags [P.], seq 264:332, ack 1, win 501, length 68
18:52:36.968613 IP lamp-ubuntu-s-1vcpu-1gb-tor1-01.ssh > 198.96.87.225.57001: Flags [P.], seq 332:368, ack 1, win 501, length 36
18:52:36.971659 IP 198.96.87.225.57001 > lamp-ubuntu-s-1vcpu-1gb-tor1-01.ssh: Flags [.], ack 368, win 510, length 0
18:52:37.069659 IP lamp-ubuntu-s-1vcpu-1gb-tor1-01.37097 > 67.207.67.3.domain: 43451+ [1au] PTR? 225.87.96.198.in-addr.arpa. (55)
18:52:37.069757 IP lamp-ubuntu-s-1vcpu-1gb-tor1-01.53995 > 67.207.67.3.domain: 35377+ [1au] PTR? 225.87.96.198.in-addr.arpa. (55)
18:52:37.069798 IP lamp-ubuntu-s-1vcpu-1gb-tor1-01.54396 > 67.207.67.3.domain: Flags [S], seq 375439616, win 64240, options [mss 1460,sackOK,TS val 526243101 ecr 0,nop,wscale 7,tfo  cookiereq,nop,nop], length 0
18:52:37.071520 IP 67.207.67.3.domain > lamp-ubuntu-s-1vcpu-1gb-tor1-01.54396: Flags [S.], seq 1407206843, ack 375439617, win 65160, options [mss 1460,sackOK,TS val 3618035860 ecr 526243101,nop,wscale 9], length 0
18:52:37.071602 IP lamp-ubuntu-s-1vcpu-1gb-tor1-01.54396 > 67.207.67.3.domain: Flags [.], ack 1, win 502, options [nop,nop,TS val 526243103 ecr 3618035860], length 0
18:52:37.071669 IP lamp-ubuntu-s-1vcpu-1gb-tor1-01.54396 > 67.207.67.3.domain: Flags [P.], seq 1:47, ack 1, win 502, options [nop,nop,TS val 526243103 ecr 3618035860], length 46 56769+ PTR? 225.87.96.198.in-addr.arpa. (44)
18:52:37.072016 IP 67.207.67.3.domain > lamp-ubuntu-s-1vcpu-1gb-tor1-01.54396: Flags [.], ack 47, win 128, options [nop,nop,TS val 3618035861 ecr 526243103], length 0
18:52:37.073479 IP 67.207.67.3.domain > lamp-ubuntu-s-1vcpu-1gb-tor1-01.37097: 43451 NXDomain 0/1/1 (120)
18:52:37.073479 IP 67.207.67.3.domain > lamp-ubuntu-s-1vcpu-1gb-tor1-01.53995: 35377 NXDomain 0/1/1 (120)
18:52:37.073736 IP lamp-ubuntu-s-1vcpu-1gb-tor1-01.37097 > 67.207.67.3.domain: 43451+ PTR? 225.87.96.198.in-addr.arpa. (44)
18:52:37.073789 IP lamp-ubuntu-s-1vcpu-1gb-tor1-01.53995 > 67.207.67.3.domain: 35377+ PTR? 225.87.96.198.in-addr.arpa. (44)
18:52:37.074923 IP 67.207.67.3.domain > lamp-ubuntu-s-1vcpu-1gb-tor1-01.54396: Flags [P.], seq 1:112, ack 47, win 128, options [nop,nop,TS val 3618035864 ecr 526243103], length 111 56769 NXDomain 0/1/0 (109)
18:52:37.074975 IP lamp-ubuntu-s-1vcpu-1gb-tor1-01.54396 > 67.207.67.3.domain: Flags [.], ack 112, win 502, options [nop,nop,TS val 526243106 ecr 3618035864], length 0
18:52:37.076274 IP 67.207.67.3.domain > lamp-ubuntu-s-1vcpu-1gb-tor1-01.53995: 35377 NXDomain 0/1/0 (109)
18:52:37.076541 IP 67.207.67.3.domain > lamp-ubuntu-s-1vcpu-1gb-tor1-01.37097: 43451 NXDomain 0/1/0 (109)
18:52:37.077794 IP lamp-ubuntu-s-1vcpu-1gb-tor1-01.59847 > 67.207.67.3.domain: 13592+ [1au] PTR? 107.60.203.159.in-addr.arpa. (56)
18:52:37.096457 IP 67.207.67.3.domain > lamp-ubuntu-s-1vcpu-1gb-tor1-01.59847: 13592 NXDomain 0/1/1 (123)
18:52:37.096767 IP lamp-ubuntu-s-1vcpu-1gb-tor1-01.59847 > 67.207.67.3.domain: 13592+ PTR? 107.60.203.159.in-addr.arpa. (45)
18:52:37.097355 IP 67.207.67.3.domain > lamp-ubuntu-s-1vcpu-1gb-tor1-01.59847: 13592 NXDomain 0/1/0 (112)
18:52:37.097977 IP lamp-ubuntu-s-1vcpu-1gb-tor1-01.ssh > 198.96.87.225.57001: Flags [P.], seq 368:556, ack 1, win 501, length 188
18:52:37.098051 IP lamp-ubuntu-s-1vcpu-1gb-tor1-01.ssh > 198.96.87.225.57001: Flags [P.], seq 556:592, ack 1, win 501, length 36
18:52:37.098120 IP lamp-ubuntu-s-1vcpu-1gb-tor1-01.ssh > 198.96.87.225.57001: Flags [P.], seq 592:756, ack 1, win 501, length 164
18:52:37.098151 IP lamp-ubuntu-s-1vcpu-1gb-tor1-01.ssh > 198.96.87.225.57001: Flags [P.], seq 756:792, ack 1, win 501, length 36
18:52:37.098188 IP lamp-ubuntu-s-1vcpu-1gb-tor1-01.ssh > 198.96.87.225.57001: Flags [P.], seq 792:956, ack 1, win 501, length 164
18:52:37.098216 IP lamp-ubuntu-s-1vcpu-1gb-tor1-01.ssh > 198.96.87.225.57001: Flags [P.], seq 956:992, ack 1, win 501, length 36
18:52:37.098256 IP lamp-ubuntu-s-1vcpu-1gb-tor1-01.ssh > 198.96.87.225.57001: Flags [P.], seq 992:1156, ack 1, win 501, length 164
18:52:37.098339 IP lamp-ubuntu-s-1vcpu-1gb-tor1-01.ssh > 198.96.87.225.57001: Flags [P.], seq 1156:1356, ack 1, win 501, length 200
18:52:37.099480 IP lamp-ubuntu-s-1vcpu-1gb-tor1-01.ssh > 198.96.87.225.57001: Flags [P.], seq 1356:1784, ack 1, win 501, length 428
18:52:37.102764 IP 198.96.87.225.57001 > lamp-ubuntu-s-1vcpu-1gb-tor1-01.ssh: Flags [.], ack 1784, win 512, length 0
18:52:37.173045 IP lamp-ubuntu-s-1vcpu-1gb-tor1-01.60324 > 67.207.67.3.domain: 48607+ [1au] PTR? 3.67.207.67.in-addr.arpa. (53)
18:52:37.173139 IP lamp-ubuntu-s-1vcpu-1gb-tor1-01.44445 > 67.207.67.3.domain: 11266+ [1au] PTR? 3.67.207.67.in-addr.arpa. (53)
18:52:37.173185 IP lamp-ubuntu-s-1vcpu-1gb-tor1-01.54396 > 67.207.67.3.domain: Flags [P.], seq 47:91, ack 112, win 502, options [nop,nop,TS val 526243204 ecr 3618035864], length 44 31227+ PTR? 3.67.207.67.in-addr.arpa. (42)
18:52:37.173520 IP 67.207.67.3.domain > lamp-ubuntu-s-1vcpu-1gb-tor1-01.60324: 48607 NXDomain 0/1/1 (120)
18:52:37.173586 IP 67.207.67.3.domain > lamp-ubuntu-s-1vcpu-1gb-tor1-01.54396: Flags [P.], seq 112:223, ack 91, win 128, options [nop,nop,TS val 3618035963 ecr 526243204], length 111 31227 NXDomain 0/1/0 (109)
18:52:37.173586 IP 67.207.67.3.domain > lamp-ubuntu-s-1vcpu-1gb-tor1-01.44445: 11266 NXDomain 0/1/1 (120)
18:52:37.173614 IP lamp-ubuntu-s-1vcpu-1gb-tor1-01.54396 > 67.207.67.3.domain: Flags [.], ack 223, win 502, options [nop,nop,TS val 526243205 ecr 3618035963], length 0
18:52:37.173782 IP lamp-ubuntu-s-1vcpu-1gb-tor1-01.60324 > 67.207.67.3.domain: 48607+ PTR? 3.67.207.67.in-addr.arpa. (42)
18:52:37.173824 IP lamp-ubuntu-s-1vcpu-1gb-tor1-01.44445 > 67.207.67.3.domain: 11266+ PTR? 3.67.207.67.in-addr.arpa. (42)
18:52:37.174102 IP 67.207.67.3.domain > lamp-ubuntu-s-1vcpu-1gb-tor1-01.60324: 48607 NXDomain 0/1/0 (109)
18:52:37.174102 IP 67.207.67.3.domain > lamp-ubuntu-s-1vcpu-1gb-tor1-01.44445: 11266 NXDomain 0/1/0 (109)
18:52:37.175537 IP lamp-ubuntu-s-1vcpu-1gb-tor1-01.ssh > 198.96.87.225.57001: Flags [P.], seq 1784:1948, ack 1, win 501, length 164
18:52:37.175631 IP lamp-ubuntu-s-1vcpu-1gb-tor1-01.ssh > 198.96.87.225.57001: Flags [P.], seq 1948:1984, ack 1, win 501, length 36
18:52:37.175729 IP lamp-ubuntu-s-1vcpu-1gb-tor1-01.ssh > 198.96.87.225.57001: Flags [P.], seq 1984:2148, ack 1, win 501, length 164
18:52:37.175773 IP lamp-ubuntu-s-1vcpu-1gb-tor1-01.ssh > 198.96.87.225.57001: Flags [P.], seq 2148:2184, ack 1, win 501, length 36
18:52:37.175850 IP lamp-ubuntu-s-1vcpu-1gb-tor1-01.ssh > 198.96.87.225.57001: Flags [P.], seq 2184:2428, ack 1, win 501, length 244
18:52:37.175888 IP lamp-ubuntu-s-1vcpu-1gb-tor1-01.ssh > 198.96.87.225.57001: Flags [P.], seq 2428:2464, ack 1, win 501, length 36
18:52:37.175970 IP lamp-ubuntu-s-1vcpu-1gb-tor1-01.ssh > 198.96.87.225.57001: Flags [P.], seq 2464:2716, ack 1, win 501, length 252
18:52:37.176008 IP lamp-ubuntu-s-1vcpu-1gb-tor1-01.ssh > 198.96.87.225.57001: Flags [P.], seq 2716:2752, ack 1, win 501, length 36
18:52:37.176065 IP lamp-ubuntu-s-1vcpu-1gb-tor1-01.ssh > 198.96.87.225.57001: Flags [P.], seq 2752:2956, ack 1, win 501, length 204
18:52:37.176103 IP lamp-ubuntu-s-1vcpu-1gb-tor1-01.ssh > 198.96.87.225.57001: Flags [P.], seq 2956:2992, ack 1, win 501, length 36
18:52:37.179375 IP 198.96.87.225.57001 > lamp-ubuntu-s-1vcpu-1gb-tor1-01.ssh: Flags [.], ack 2992, win 507, length 0
18:52:37.179451 IP lamp-ubuntu-s-1vcpu-1gb-tor1-01.ssh > 198.96.87.225.57001: Flags [P.], seq 2992:5492, ack 1, win 501, length 2500
18:52:37.179475 IP lamp-ubuntu-s-1vcpu-1gb-tor1-01.ssh > 198.96.87.225.57001: Flags [P.], seq 5492:7912, ack 1, win 501, length 2420
18:52:37.182409 IP 198.96.87.225.57001 > lamp-ubuntu-s-1vcpu-1gb-tor1-01.ssh: Flags [.], ack 7912, win 512, length 0
18:52:37.276655 IP lamp-ubuntu-s-1vcpu-1gb-tor1-01.ssh > 198.96.87.225.57001: Flags [P.], seq 7912:8076, ack 1, win 501, length 164
18:52:37.276781 IP lamp-ubuntu-s-1vcpu-1gb-tor1-01.ssh > 198.96.87.225.57001: Flags [P.], seq 8076:8112, ack 1, win 501, length 36
18:52:37.276826 IP lamp-ubuntu-s-1vcpu-1gb-tor1-01.ssh > 198.96.87.225.57001: Flags [P.], seq 8112:8276, ack 1, win 501, length 164
18:52:37.276865 IP lamp-ubuntu-s-1vcpu-1gb-tor1-01.ssh > 198.96.87.225.57001: Flags [P.], seq 8276:8312, ack 1, win 501, length 36
18:52:37.276932 IP lamp-ubuntu-s-1vcpu-1gb-tor1-01.ssh > 198.96.87.225.57001: Flags [P.], seq 8312:8572, ack 1, win 501, length 260
18:52:37.277018 IP lamp-ubuntu-s-1vcpu-1gb-tor1-01.ssh > 198.96.87.225.57001: Flags [P.], seq 8572:8608, ack 1, win 501, length 36
18:52:37.277067 IP lamp-ubuntu-s-1vcpu-1gb-tor1-01.ssh > 198.96.87.225.57001: Flags [P.], seq 8608:8748, ack 1, win 501, length 140
18:52:37.277115 IP lamp-ubuntu-s-1vcpu-1gb-tor1-01.ssh > 198.96.87.225.57001: Flags [P.], seq 8748:8784, ack 1, win 501, length 36
18:52:37.277171 IP lamp-ubuntu-s-1vcpu-1gb-tor1-01.ssh > 198.96.87.225.57001: Flags [P.], seq 8784:9028, ack 1, win 501, length 244
18:52:37.277200 IP lamp-ubuntu-s-1vcpu-1gb-tor1-01.ssh > 198.96.87.225.57001: Flags [P.], seq 9028:9064, ack 1, win 501, length 36
18:52:37.277236 IP lamp-ubuntu-s-1vcpu-1gb-tor1-01.ssh > 198.96.87.225.57001: Flags [P.], seq 9064:9204, ack 1, win 501, length 140
18:52:37.277265 IP lamp-ubuntu-s-1vcpu-1gb-tor1-01.ssh > 198.96.87.225.57001: Flags [P.], seq 9204:9240, ack 1, win 501, length 36
18:52:37.280166 IP 198.96.87.225.57001 > lamp-ubuntu-s-1vcpu-1gb-tor1-01.ssh: Flags [.], ack 9240, win 512, length 0
18:52:37.280247 IP lamp-ubuntu-s-1vcpu-1gb-tor1-01.ssh > 198.96.87.225.57001: Flags [P.], seq 9240:11740, ack 1, win 501, length 2500
18:52:37.280273 IP lamp-ubuntu-s-1vcpu-1gb-tor1-01.ssh > 198.96.87.225.57001: Flags [P.], seq 11740:13056, ack 1, win 501, length 1316
18:52:37.283346 IP 198.96.87.225.57001 > lamp-ubuntu-s-1vcpu-1gb-tor1-01.ssh: Flags [.], ack 13056, win 512, length 0
18:52:37.380644 IP lamp-ubuntu-s-1vcpu-1gb-tor1-01.ssh > 198.96.87.225.57001: Flags [P.], seq 13056:13228, ack 1, win 501, length 172
18:52:37.380741 IP lamp-ubuntu-s-1vcpu-1gb-tor1-01.ssh > 198.96.87.225.57001: Flags [P.], seq 13228:13428, ack 1, win 501, length 200
18:52:37.380776 IP lamp-ubuntu-s-1vcpu-1gb-tor1-01.ssh > 198.96.87.225.57001: Flags [P.], seq 13428:13464, ack 1, win 501, length 36
18:52:37.380813 IP lamp-ubuntu-s-1vcpu-1gb-tor1-01.ssh > 198.96.87.225.57001: Flags [P.], seq 13464:13636, ack 1, win 501, length 172
18:52:37.380856 IP lamp-ubuntu-s-1vcpu-1gb-tor1-01.ssh > 198.96.87.225.57001: Flags [P.], seq 13636:13672, ack 1, win 501, length 36
18:52:37.380879 IP lamp-ubuntu-s-1vcpu-1gb-tor1-01.ssh > 198.96.87.225.57001: Flags [P.], seq 13672:13836, ack 1, win 501, length 164
18:52:37.380907 IP lamp-ubuntu-s-1vcpu-1gb-tor1-01.ssh > 198.96.87.225.57001: Flags [P.], seq 13836:13872, ack 1, win 501, length 36
18:52:37.380943 IP lamp-ubuntu-s-1vcpu-1gb-tor1-01.ssh > 198.96.87.225.57001: Flags [P.], seq 13872:14044, ack 1, win 501, length 172
18:52:37.380970 IP lamp-ubuntu-s-1vcpu-1gb-tor1-01.ssh > 198.96.87.225.57001: Flags [P.], seq 14044:14080, ack 1, win 501, length 36
18:52:37.381007 IP lamp-ubuntu-s-1vcpu-1gb-tor1-01.ssh > 198.96.87.225.57001: Flags [P.], seq 14080:14244, ack 1, win 501, length 164
18:52:37.381034 IP lamp-ubuntu-s-1vcpu-1gb-tor1-01.ssh > 198.96.87.225.57001: Flags [P.], seq 14244:14280, ack 1, win 501, length 36
18:52:37.381083 IP lamp-ubuntu-s-1vcpu-1gb-tor1-01.ssh > 198.96.87.225.57001: Flags [P.], seq 14280:14452, ack 1, win 501, length 172
18:52:37.384288 IP 198.96.87.225.57001 > lamp-ubuntu-s-1vcpu-1gb-tor1-01.ssh: Flags [.], ack 14452, win 512, length 0
18:52:37.384380 IP lamp-ubuntu-s-1vcpu-1gb-tor1-01.ssh > 198.96.87.225.57001: Flags [P.], seq 14452:16304, ack 1, win 501, length 1852
18:52:37.387428 IP 198.96.87.225.57001 > lamp-ubuntu-s-1vcpu-1gb-tor1-01.ssh: Flags [.], ack 16304, win 512, length 0
18:52:37.438906 IP 175.215.143.90.33062 > lamp-ubuntu-s-1vcpu-1gb-tor1-01.ssh: Flags [P.], seq 2054958845:2054958941, ack 87769570, win 1073, options [nop,nop,TS val 2000373323 ecr 2229429045], length 96
18:52:37.439005 IP lamp-ubuntu-s-1vcpu-1gb-tor1-01.ssh > 175.215.143.90.33062: Flags [.], ack 96, win 501, options [nop,nop,TS val 2229429621 ecr 2000373323], length 0
18:52:37.484829 IP lamp-ubuntu-s-1vcpu-1gb-tor1-01.ssh > 198.96.87.225.57001: Flags [P.], seq 16304:16476, ack 1, win 501, length 172
18:52:37.484951 IP lamp-ubuntu-s-1vcpu-1gb-tor1-01.ssh > 198.96.87.225.57001: Flags [P.], seq 16476:16512, ack 1, win 501, length 36
18:52:37.484989 IP lamp-ubuntu-s-1vcpu-1gb-tor1-01.ssh > 198.96.87.225.57001: Flags [P.], seq 16512:16684, ack 1, win 501, length 172
18:52:37.485035 IP lamp-ubuntu-s-1vcpu-1gb-tor1-01.ssh > 198.96.87.225.57001: Flags [P.], seq 16684:16720, ack 1, win 501, length 36
18:52:37.485093 IP lamp-ubuntu-s-1vcpu-1gb-tor1-01.ssh > 198.96.87.225.57001: Flags [P.], seq 16720:16892, ack 1, win 501, length 172
18:52:37.485130 IP lamp-ubuntu-s-1vcpu-1gb-tor1-01.ssh > 198.96.87.225.57001: Flags [P.], seq 16892:16928, ack 1, win 501, length 36
18:52:37.485181 IP lamp-ubuntu-s-1vcpu-1gb-tor1-01.ssh > 198.96.87.225.57001: Flags [P.], seq 16928:17100, ack 1, win 501, length 172
18:52:37.485222 IP lamp-ubuntu-s-1vcpu-1gb-tor1-01.ssh > 198.96.87.225.57001: Flags [P.], seq 17100:17136, ack 1, win 501, length 36
18:52:37.485273 IP lamp-ubuntu-s-1vcpu-1gb-tor1-01.ssh > 198.96.87.225.57001: Flags [P.], seq 17136:17308, ack 1, win 501, length 172
18:52:37.485310 IP lamp-ubuntu-s-1vcpu-1gb-tor1-01.ssh > 198.96.87.225.57001: Flags [P.], seq 17308:17344, ack 1, win 501, length 36
18:52:37.485358 IP lamp-ubuntu-s-1vcpu-1gb-tor1-01.ssh > 198.96.87.225.57001: Flags [P.], seq 17344:17516, ack 1, win 501, length 172
18:52:37.485394 IP lamp-ubuntu-s-1vcpu-1gb-tor1-01.ssh > 198.96.87.225.57001: Flags [P.], seq 17516:17552, ack 1, win 501, length 36
18:52:37.486504 IP lamp-ubuntu-s-1vcpu-1gb-tor1-01.53751 > 67.207.67.3.domain: 62010+ [1au] PTR? 90.143.215.175.in-addr.arpa. (56)
18:52:37.486622 IP lamp-ubuntu-s-1vcpu-1gb-tor1-01.48420 > 67.207.67.3.domain: 951+ [1au] PTR? 90.143.215.175.in-addr.arpa. (56)
18:52:37.486664 IP lamp-ubuntu-s-1vcpu-1gb-tor1-01.54396 > 67.207.67.3.domain: Flags [P.], seq 91:138, ack 223, win 502, options [nop,nop,TS val 526243518 ecr 3618035963], length 47 28804+ PTR? 90.143.215.175.in-addr.arpa. (45)
18:52:37.488194 IP 198.96.87.225.57001 > lamp-ubuntu-s-1vcpu-1gb-tor1-01.ssh: Flags [.], ack 17552, win 507, length 0
18:52:37.488250 IP lamp-ubuntu-s-1vcpu-1gb-tor1-01.ssh > 198.96.87.225.57001: Flags [P.], seq 17552:19392, ack 1, win 501, length 1840
18:52:37.494090 IP 198.96.87.225.57001 > lamp-ubuntu-s-1vcpu-1gb-tor1-01.ssh: Flags [.], ack 19392, win 512, length 0
18:52:37.533008 IP 67.207.67.3.domain > lamp-ubuntu-s-1vcpu-1gb-tor1-01.54396: Flags [.], ack 138, win 128, options [nop,nop,TS val 3618036322 ecr 526243518], length 0
18:52:37.806955 IP 218.92.0.252.5500 > lamp-ubuntu-s-1vcpu-1gb-tor1-01.ssh: Flags [S], seq 92623346, win 64240, options [mss 1460,sackOK,TS val 4124634443 ecr 0,nop,wscale 7], length 0
18:52:37.807035 IP lamp-ubuntu-s-1vcpu-1gb-tor1-01.ssh > 218.92.0.252.5500: Flags [S.], seq 2045483335, ack 92623347, win 65160, options [mss 1460,sackOK,TS val 3253748365 ecr 4124634443,nop,wscale 7], length 0
18:52:37.854704 IP 67.207.67.3.domain > lamp-ubuntu-s-1vcpu-1gb-tor1-01.54396: Flags [P.], seq 223:329, ack 138, win 128, options [nop,nop,TS val 3618036644 ecr 526243518], length 106 28804 NXDomain 0/1/0 (104)
18:52:37.854769 IP lamp-ubuntu-s-1vcpu-1gb-tor1-01.54396 > 67.207.67.3.domain: Flags [.], ack 329, win 502, options [nop,nop,TS val 526243886 ecr 3618036644], length 0
18:52:37.854975 IP 67.207.67.3.domain > lamp-ubuntu-s-1vcpu-1gb-tor1-01.53751: 62010 NXDomain 0/1/1 (115)
18:52:37.855424 IP lamp-ubuntu-s-1vcpu-1gb-tor1-01.53751 > 67.207.67.3.domain: 62010+ PTR? 90.143.215.175.in-addr.arpa. (45)
18:52:37.856151 IP 67.207.67.3.domain > lamp-ubuntu-s-1vcpu-1gb-tor1-01.53751: 62010 NXDomain 0/1/0 (104)
18:52:37.893804 IP 67.207.67.3.domain > lamp-ubuntu-s-1vcpu-1gb-tor1-01.48420: 951 NXDomain 0/1/1 (115)
18:52:37.894024 IP lamp-ubuntu-s-1vcpu-1gb-tor1-01.48420 > 67.207.67.3.domain: 951+ PTR? 90.143.215.175.in-addr.arpa. (45)
18:52:37.894860 IP 67.207.67.3.domain > lamp-ubuntu-s-1vcpu-1gb-tor1-01.48420: 951 NXDomain 0/1/0 (104)
18:52:37.895844 IP lamp-ubuntu-s-1vcpu-1gb-tor1-01.ssh > 198.96.87.225.57001: Flags [P.], seq 19392:21892, ack 1, win 501, length 2500
18:52:37.895924 IP lamp-ubuntu-s-1vcpu-1gb-tor1-01.ssh > 198.96.87.225.57001: Flags [P.], seq 21892:22452, ack 1, win 501, length 560
18:52:37.901093 IP lamp-ubuntu-s-1vcpu-1gb-tor1-01.41077 > 67.207.67.3.domain: 42779+ [1au] PTR? 252.0.92.218.in-addr.arpa. (54)
18:52:37.901218 IP lamp-ubuntu-s-1vcpu-1gb-tor1-01.34986 > 67.207.67.3.domain: 27373+ [1au] PTR? 252.0.92.218.in-addr.arpa. (54)
18:52:37.901264 IP lamp-ubuntu-s-1vcpu-1gb-tor1-01.54396 > 67.207.67.3.domain: Flags [P.], seq 138:183, ack 329, win 502, options [nop,nop,TS val 526243932 ecr 3618036644], length 45 25741+ PTR? 252.0.92.218.in-addr.arpa. (43)
18:52:37.901593 IP 67.207.67.3.domain > lamp-ubuntu-s-1vcpu-1gb-tor1-01.54396: Flags [.], ack 183, win 128, options [nop,nop,TS val 3618036691 ecr 526243932], length 0
18:52:37.901667 IP 67.207.67.3.domain > lamp-ubuntu-s-1vcpu-1gb-tor1-01.54396: Flags [P.], seq 329:423, ack 183, win 128, options [nop,nop,TS val 3618036691 ecr 526243932], length 94 25741 NXDomain 0/1/0 (92)
18:52:37.901674 IP lamp-ubuntu-s-1vcpu-1gb-tor1-01.54396 > 67.207.67.3.domain: Flags [.], ack 423, win 502, options [nop,nop,TS val 526243933 ecr 3618036691], length 0
18:52:37.902223 IP 67.207.67.3.domain > lamp-ubuntu-s-1vcpu-1gb-tor1-01.41077: 42779 NXDomain 0/1/1 (103)
18:52:37.902223 IP 67.207.67.3.domain > lamp-ubuntu-s-1vcpu-1gb-tor1-01.34986: 27373 NXDomain 0/1/1 (103)
18:52:37.902472 IP lamp-ubuntu-s-1vcpu-1gb-tor1-01.41077 > 67.207.67.3.domain: 42779+ PTR? 252.0.92.218.in-addr.arpa. (43)
18:52:37.902544 IP lamp-ubuntu-s-1vcpu-1gb-tor1-01.34986 > 67.207.67.3.domain: 27373+ PTR? 252.0.92.218.in-addr.arpa. (43)
18:52:37.902845 IP 67.207.67.3.domain > lamp-ubuntu-s-1vcpu-1gb-tor1-01.34986: 27373 NXDomain 0/1/0 (92)
18:52:37.902886 IP 67.207.67.3.domain > lamp-ubuntu-s-1vcpu-1gb-tor1-01.41077: 42779 NXDomain 0/1/0 (92)
18:52:37.903727 IP lamp-ubuntu-s-1vcpu-1gb-tor1-01.ssh > 198.96.87.225.57001: Flags [P.], seq 22452:24216, ack 1, win 501, length 1764
18:52:37.928142 IP 198.96.87.225.57001 > lamp-ubuntu-s-1vcpu-1gb-tor1-01.ssh: Flags [.], ack 24216, win 512, length 0
18:52:38.004935 IP lamp-ubuntu-s-1vcpu-1gb-tor1-01.ssh > 198.96.87.225.57001: Flags [P.], seq 24216:26220, ack 1, win 501, length 2004
18:52:38.010862 IP 198.96.87.225.57001 > lamp-ubuntu-s-1vcpu-1gb-tor1-01.ssh: Flags [.], ack 26220, win 512, length 0
18:52:38.028846 IP 218.92.0.252.5500 > lamp-ubuntu-s-1vcpu-1gb-tor1-01.ssh: Flags [.], ack 1, win 502, options [nop,nop,TS val 4124634666 ecr 3253748365], length 0
18:52:38.028846 IP 218.92.0.252.5500 > lamp-ubuntu-s-1vcpu-1gb-tor1-01.ssh: Flags [P.], seq 1:16, ack 1, win 502, options [nop,nop,TS val 4124634666 ecr 3253748365], length 15
18:52:38.045090 IP lamp-ubuntu-s-1vcpu-1gb-tor1-01.ssh > 218.92.0.252.5500: Flags [P.], seq 1:43, ack 1, win 510, options [nop,nop,TS val 3253748603 ecr 4124634666], length 42: SSH: SSH-2.0-OpenSSH_8.9p1 Ubuntu-3ubuntu0.10
18:52:38.108877 IP lamp-ubuntu-s-1vcpu-1gb-tor1-01.ssh > 198.96.87.225.57001: Flags [P.], seq 26220:27080, ack 1, win 501, length 860
18:52:38.161543 IP 198.96.87.225.57001 > lamp-ubuntu-s-1vcpu-1gb-tor1-01.ssh: Flags [.], ack 27080, win 509, length 0
18:52:38.212744 IP lamp-ubuntu-s-1vcpu-1gb-tor1-01.ssh > 198.96.87.225.57001: Flags [P.], seq 27080:27372, ack 1, win 501, length 292
18:52:38.262705 IP 198.96.87.225.57001 > lamp-ubuntu-s-1vcpu-1gb-tor1-01.ssh: Flags [.], ack 27372, win 508, length 0
18:52:38.266413 IP 218.92.0.252.5500 > lamp-ubuntu-s-1vcpu-1gb-tor1-01.ssh: Flags [.], ack 43, win 502, options [nop,nop,TS val 4124634903 ecr 3253748603], length 0
18:52:38.266467 IP 218.92.0.252.5500 > lamp-ubuntu-s-1vcpu-1gb-tor1-01.ssh: Flags [P.], seq 16:688, ack 43, win 502, options [nop,nop,TS val 4124634903 ecr 3253748603], length 672
18:52:38.316800 IP lamp-ubuntu-s-1vcpu-1gb-tor1-01.ssh > 198.96.87.225.57001: Flags [P.], seq 27372:28008, ack 1, win 501, length 636
18:52:38.371460 IP 198.96.87.225.57001 > lamp-ubuntu-s-1vcpu-1gb-tor1-01.ssh: Flags [.], ack 28008, win 512, length 0
18:52:38.420780 IP lamp-ubuntu-s-1vcpu-1gb-tor1-01.ssh > 198.96.87.225.57001: Flags [P.], seq 28008:28300, ack 1, win 501, length 292
18:52:38.480780 IP 198.96.87.225.57001 > lamp-ubuntu-s-1vcpu-1gb-tor1-01.ssh: Flags [.], ack 28300, win 511, length 0
18:52:38.524786 IP lamp-ubuntu-s-1vcpu-1gb-tor1-01.ssh > 198.96.87.225.57001: Flags [P.], seq 28300:28592, ack 1, win 501, length 292
18:52:38.571763 IP 198.96.87.225.57001 > lamp-ubuntu-s-1vcpu-1gb-tor1-01.ssh: Flags [.], ack 28592, win 510, length 0
18:52:38.628688 IP lamp-ubuntu-s-1vcpu-1gb-tor1-01.ssh > 198.96.87.225.57001: Flags [P.], seq 28592:28884, ack 1, win 501, length 292
18:52:38.679572 IP 198.96.87.225.57001 > lamp-ubuntu-s-1vcpu-1gb-tor1-01.ssh: Flags [.], ack 28884, win 509, length 0
18:52:38.722747 IP 218.92.0.252.5500 > lamp-ubuntu-s-1vcpu-1gb-tor1-01.ssh: Flags [P.], seq 16:688, ack 43, win 502, options [nop,nop,TS val 4124635360 ecr 3253748603], length 672
18:52:38.722813 IP lamp-ubuntu-s-1vcpu-1gb-tor1-01.ssh > 218.92.0.252.5500: Flags [.], ack 1, win 510, options [nop,nop,TS val 3253749281 ecr 4124634666,nop,nop,sack 1 {16:688}], length 0
18:52:38.732786 IP lamp-ubuntu-s-1vcpu-1gb-tor1-01.ssh > 198.96.87.225.57001: Flags [P.], seq 28884:29544, ack 1, win 501, length 660
18:52:38.789119 IP 198.96.87.225.57001 > lamp-ubuntu-s-1vcpu-1gb-tor1-01.ssh: Flags [.], ack 29544, win 512, length 0
18:52:38.836904 IP lamp-ubuntu-s-1vcpu-1gb-tor1-01.ssh > 198.96.87.225.57001: Flags [P.], seq 29544:29836, ack 1, win 501, length 292
18:52:38.883414 IP 198.96.87.225.57001 > lamp-ubuntu-s-1vcpu-1gb-tor1-01.ssh: Flags [.], ack 29836, win 511, length 0
18:52:38.940745 IP lamp-ubuntu-s-1vcpu-1gb-tor1-01.ssh > 198.96.87.225.57001: Flags [P.], seq 29836:30128, ack 1, win 501, length 292
18:52:39.006017 IP 198.96.87.225.57001 > lamp-ubuntu-s-1vcpu-1gb-tor1-01.ssh: Flags [.], ack 30128, win 510, length 0
18:52:39.044770 IP lamp-ubuntu-s-1vcpu-1gb-tor1-01.ssh > 198.96.87.225.57001: Flags [P.], seq 30128:30420, ack 1, win 501, length 292
18:52:39.099535 IP 198.96.87.225.57001 > lamp-ubuntu-s-1vcpu-1gb-tor1-01.ssh: Flags [.], ack 30420, win 509, length 0
18:52:39.148739 IP lamp-ubuntu-s-1vcpu-1gb-tor1-01.ssh > 198.96.87.225.57001: Flags [P.], seq 30420:30712, ack 1, win 501, length 292
18:52:39.191621 IP 198.96.87.225.57001 > lamp-ubuntu-s-1vcpu-1gb-tor1-01.ssh: Flags [.], ack 30712, win 508, length 0
18:52:39.252836 IP lamp-ubuntu-s-1vcpu-1gb-tor1-01.ssh > 198.96.87.225.57001: Flags [P.], seq 30712:31004, ack 1, win 501, length 292
18:52:39.300549 IP 198.96.87.225.57001 > lamp-ubuntu-s-1vcpu-1gb-tor1-01.ssh: Flags [.], ack 31004, win 512, length 0
18:52:39.356705 IP lamp-ubuntu-s-1vcpu-1gb-tor1-01.ssh > 198.96.87.225.57001: Flags [P.], seq 31004:31296, ack 1, win 501, length 292
18:52:39.408757 IP 198.96.87.225.57001 > lamp-ubuntu-s-1vcpu-1gb-tor1-01.ssh: Flags [.], ack 31296, win 511, length 0
18:52:39.460859 IP lamp-ubuntu-s-1vcpu-1gb-tor1-01.ssh > 198.96.87.225.57001: Flags [P.], seq 31296:31588, ack 1, win 501, length 292
18:52:39.515500 IP 198.96.87.225.57001 > lamp-ubuntu-s-1vcpu-1gb-tor1-01.ssh: Flags [.], ack 31588, win 510, length 0
18:52:39.564698 IP lamp-ubuntu-s-1vcpu-1gb-tor1-01.ssh > 198.96.87.225.57001: Flags [P.], seq 31588:31880, ack 1, win 501, length 292
18:52:39.623312 IP 198.96.87.225.57001 > lamp-ubuntu-s-1vcpu-1gb-tor1-01.ssh: Flags [.], ack 31880, win 509, length 0
18:52:39.668717 IP lamp-ubuntu-s-1vcpu-1gb-tor1-01.ssh > 198.96.87.225.57001: Flags [P.], seq 31880:32172, ack 1, win 501, length 292
18:52:39.731603 IP 198.96.87.225.57001 > lamp-ubuntu-s-1vcpu-1gb-tor1-01.ssh: Flags [.], ack 32172, win 508, length 0
18:52:39.772691 IP lamp-ubuntu-s-1vcpu-1gb-tor1-01.ssh > 198.96.87.225.57001: Flags [P.], seq 32172:32464, ack 1, win 501, length 292
18:52:39.824601 IP 198.96.87.225.57001 > lamp-ubuntu-s-1vcpu-1gb-tor1-01.ssh: Flags [.], ack 32464, win 512, length 0
18:52:39.876755 IP lamp-ubuntu-s-1vcpu-1gb-tor1-01.ssh > 198.96.87.225.57001: Flags [P.], seq 32464:32756, ack 1, win 501, length 292
18:52:39.934200 IP 198.96.87.225.57001 > lamp-ubuntu-s-1vcpu-1gb-tor1-01.ssh: Flags [.], ack 32756, win 511, length 0
18:52:39.980754 IP lamp-ubuntu-s-1vcpu-1gb-tor1-01.ssh > 198.96.87.225.57001: Flags [P.], seq 32756:33048, ack 1, win 501, length 292
18:52:40.042157 IP 198.96.87.225.57001 > lamp-ubuntu-s-1vcpu-1gb-tor1-01.ssh: Flags [.], ack 33048, win 510, length 0
18:52:40.054739 IP lamp-ubuntu-s-1vcpu-1gb-tor1-01.ssh > 175.215.143.90.33062: Flags [P.], seq 1:81, ack 96, win 501, options [nop,nop,TS val 2229432237 ecr 2000373323], length 80
18:52:40.084805 IP lamp-ubuntu-s-1vcpu-1gb-tor1-01.ssh > 198.96.87.225.57001: Flags [P.], seq 33048:33524, ack 1, win 501, length 476
18:52:40.104693 IP 67.207.67.3.domain > lamp-ubuntu-s-1vcpu-1gb-tor1-01.54396: Flags [F.], seq 423, ack 183, win 128, options [nop,nop,TS val 3618038894 ecr 526243933], length 0
18:52:40.104872 IP lamp-ubuntu-s-1vcpu-1gb-tor1-01.54396 > 67.207.67.3.domain: Flags [F.], seq 183, ack 424, win 502, options [nop,nop,TS val 526246136 ecr 3618038894], length 0
18:52:40.105255 IP 67.207.67.3.domain > lamp-ubuntu-s-1vcpu-1gb-tor1-01.54396: Flags [.], ack 184, win 128, options [nop,nop,TS val 3618038895 ecr 526246136], length 0
18:52:40.135888 IP 198.96.87.225.57001 > lamp-ubuntu-s-1vcpu-1gb-tor1-01.ssh: Flags [.], ack 33524, win 508, length 0
18:52:40.188769 IP lamp-ubuntu-s-1vcpu-1gb-tor1-01.ssh > 198.96.87.225.57001: Flags [P.], seq 33524:34344, ack 1, win 501, length 820
18:52:40.292741 IP lamp-ubuntu-s-1vcpu-1gb-tor1-01.ssh > 198.96.87.225.57001: Flags [P.], seq 34344:34516, ack 1, win 501, length 172
18:52:40.336791 IP 198.96.87.225.57001 > lamp-ubuntu-s-1vcpu-1gb-tor1-01.ssh: Flags [.], ack 33524, win 508, options [nop,nop,sack 1 {34344:34516}], length 0
18:52:40.336878 IP lamp-ubuntu-s-1vcpu-1gb-tor1-01.ssh > 198.96.87.225.57001: Flags [P.], seq 33524:34344, ack 1, win 501, length 820
18:52:40.339621 IP 198.96.87.225.57001 > lamp-ubuntu-s-1vcpu-1gb-tor1-01.ssh: Flags [.], ack 34516, win 512, length 0
18:52:40.396724 IP lamp-ubuntu-s-1vcpu-1gb-tor1-01.ssh > 198.96.87.225.57001: Flags [P.], seq 34516:35104, ack 1, win 501, length 588
18:52:40.444027 IP 198.96.87.225.57001 > lamp-ubuntu-s-1vcpu-1gb-tor1-01.ssh: Flags [.], ack 35104, win 510, length 0
18:52:40.500783 IP lamp-ubuntu-s-1vcpu-1gb-tor1-01.ssh > 198.96.87.225.57001: Flags [P.], seq 35104:35396, ack 1, win 501, length 292
18:52:40.552987 IP 198.96.87.225.57001 > lamp-ubuntu-s-1vcpu-1gb-tor1-01.ssh: Flags [.], ack 35396, win 509, length 0
18:52:40.604668 IP lamp-ubuntu-s-1vcpu-1gb-tor1-01.ssh > 198.96.87.225.57001: Flags [P.], seq 35396:35688, ack 1, win 501, length 292
18:52:40.614097 IP 175.215.143.90.33062 > lamp-ubuntu-s-1vcpu-1gb-tor1-01.ssh: Flags [P.], seq 96:192, ack 81, win 1073, options [nop,nop,TS val 2000376498 ecr 2229432237], length 96
18:52:40.614201 IP lamp-ubuntu-s-1vcpu-1gb-tor1-01.ssh > 175.215.143.90.33062: Flags [.], ack 192, win 501, options [nop,nop,TS val 2229432796 ecr 2000376498], length 0
18:52:40.661369 IP 198.96.87.225.57001 > lamp-ubuntu-s-1vcpu-1gb-tor1-01.ssh: Flags [.], ack 35688, win 508, length 0
18:52:40.708754 IP lamp-ubuntu-s-1vcpu-1gb-tor1-01.ssh > 198.96.87.225.57001: Flags [P.], seq 35688:36332, ack 1, win 501, length 644
18:52:40.770544 IP 198.96.87.225.57001 > lamp-ubuntu-s-1vcpu-1gb-tor1-01.ssh: Flags [.], ack 36332, win 512, length 0
18:52:40.812757 IP lamp-ubuntu-s-1vcpu-1gb-tor1-01.ssh > 198.96.87.225.57001: Flags [P.], seq 36332:36624, ack 1, win 501, length 292
18:52:40.863012 IP 198.96.87.225.57001 > lamp-ubuntu-s-1vcpu-1gb-tor1-01.ssh: Flags [.], ack 36624, win 511, length 0
18:52:40.916784 IP lamp-ubuntu-s-1vcpu-1gb-tor1-01.ssh > 198.96.87.225.57001: Flags [P.], seq 36624:36916, ack 1, win 501, length 292
18:52:40.973190 IP 198.96.87.225.57001 > lamp-ubuntu-s-1vcpu-1gb-tor1-01.ssh: Flags [.], ack 36916, win 510, length 0
18:52:41.020743 IP lamp-ubuntu-s-1vcpu-1gb-tor1-01.ssh > 198.96.87.225.57001: Flags [P.], seq 36916:37208, ack 1, win 501, length 292
18:52:41.066063 IP 198.96.87.225.57001 > lamp-ubuntu-s-1vcpu-1gb-tor1-01.ssh: Flags [.], ack 37208, win 509, length 0
18:52:41.124772 IP lamp-ubuntu-s-1vcpu-1gb-tor1-01.ssh > 198.96.87.225.57001: Flags [P.], seq 37208:37500, ack 1, win 501, length 292
18:52:41.180219 IP 198.96.87.225.57001 > lamp-ubuntu-s-1vcpu-1gb-tor1-01.ssh: Flags [.], ack 37500, win 508, length 0
18:52:41.228911 IP lamp-ubuntu-s-1vcpu-1gb-tor1-01.ssh > 198.96.87.225.57001: Flags [P.], seq 37500:37792, ack 1, win 501, length 292
18:52:41.280749 IP 198.96.87.225.57001 > lamp-ubuntu-s-1vcpu-1gb-tor1-01.ssh: Flags [.], ack 37792, win 512, length 0
18:52:41.332709 IP lamp-ubuntu-s-1vcpu-1gb-tor1-01.ssh > 198.96.87.225.57001: Flags [P.], seq 37792:38084, ack 1, win 501, length 292
18:52:41.409771 IP 198.96.87.225.57001 > lamp-ubuntu-s-1vcpu-1gb-tor1-01.ssh: Flags [.], ack 38084, win 511, length 0
18:52:41.436782 IP lamp-ubuntu-s-1vcpu-1gb-tor1-01.ssh > 198.96.87.225.57001: Flags [P.], seq 38084:38376, ack 1, win 501, length 292
18:52:41.499385 IP 198.96.87.225.57001 > lamp-ubuntu-s-1vcpu-1gb-tor1-01.ssh: Flags [.], ack 38376, win 510, length 0
18:52:41.540766 IP lamp-ubuntu-s-1vcpu-1gb-tor1-01.ssh > 198.96.87.225.57001: Flags [P.], seq 38376:38668, ack 1, win 501, length 292
18:52:41.642915 IP 198.96.87.225.57001 > lamp-ubuntu-s-1vcpu-1gb-tor1-01.ssh: Flags [.], ack 38668, win 509, length 0
18:52:41.644693 IP lamp-ubuntu-s-1vcpu-1gb-tor1-01.ssh > 198.96.87.225.57001: Flags [P.], seq 38668:38960, ack 1, win 501, length 292
18:52:41.711728 IP 198.96.87.225.57001 > lamp-ubuntu-s-1vcpu-1gb-tor1-01.ssh: Flags [.], ack 38960, win 508, length 0
18:52:41.748665 IP lamp-ubuntu-s-1vcpu-1gb-tor1-01.ssh > 198.96.87.225.57001: Flags [P.], seq 38960:39252, ack 1, win 501, length 292
18:52:41.804287 IP 198.96.87.225.57001 > lamp-ubuntu-s-1vcpu-1gb-tor1-01.ssh: Flags [.], ack 39252, win 512, length 0
18:52:41.852760 IP lamp-ubuntu-s-1vcpu-1gb-tor1-01.ssh > 198.96.87.225.57001: Flags [P.], seq 39252:39544, ack 1, win 501, length 292
18:52:41.908786 IP 198.96.87.225.57001 > lamp-ubuntu-s-1vcpu-1gb-tor1-01.ssh: Flags [.], ack 39544, win 511, length 0
18:52:41.956779 IP lamp-ubuntu-s-1vcpu-1gb-tor1-01.ssh > 198.96.87.225.57001: Flags [P.], seq 39544:39836, ack 1, win 501, length 292
18:52:42.032123 IP 198.96.87.225.57001 > lamp-ubuntu-s-1vcpu-1gb-tor1-01.ssh: Flags [.], ack 39836, win 510, length 0
18:52:42.060752 IP lamp-ubuntu-s-1vcpu-1gb-tor1-01.ssh > 198.96.87.225.57001: Flags [P.], seq 39836:40128, ack 1, win 501, length 292
18:52:42.109305 IP 198.96.87.225.57001 > lamp-ubuntu-s-1vcpu-1gb-tor1-01.ssh: Flags [.], ack 40128, win 509, length 0
18:52:42.164739 IP lamp-ubuntu-s-1vcpu-1gb-tor1-01.ssh > 198.96.87.225.57001: Flags [P.], seq 40128:40420, ack 1, win 501, length 292
18:52:42.268732 IP lamp-ubuntu-s-1vcpu-1gb-tor1-01.ssh > 198.96.87.225.57001: Flags [P.], seq 40420:40592, ack 1, win 501, length 172
18:52:42.280747 IP 198.96.87.225.57001 > lamp-ubuntu-s-1vcpu-1gb-tor1-01.ssh: Flags [.], ack 40420, win 508, length 0
18:52:42.326412 IP 198.96.87.225.57001 > lamp-ubuntu-s-1vcpu-1gb-tor1-01.ssh: Flags [.], ack 40592, win 512, length 0
18:52:42.372778 IP lamp-ubuntu-s-1vcpu-1gb-tor1-01.ssh > 198.96.87.225.57001: Flags [P.], seq 40592:41004, ack 1, win 501, length 412
18:52:42.419037 IP 198.96.87.225.57001 > lamp-ubuntu-s-1vcpu-1gb-tor1-01.ssh: Flags [.], ack 41004, win 511, length 0
18:52:42.476717 IP lamp-ubuntu-s-1vcpu-1gb-tor1-01.ssh > 198.96.87.225.57001: Flags [P.], seq 41004:41296, ack 1, win 501, length 292
18:52:42.527964 IP 198.96.87.225.57001 > lamp-ubuntu-s-1vcpu-1gb-tor1-01.ssh: Flags [.], ack 41296, win 509, length 0
18:52:42.580820 IP lamp-ubuntu-s-1vcpu-1gb-tor1-01.ssh > 198.96.87.225.57001: Flags [P.], seq 41296:41588, ack 1, win 501, length 292
18:52:42.637557 IP 198.96.87.225.57001 > lamp-ubuntu-s-1vcpu-1gb-tor1-01.ssh: Flags [.], ack 41588, win 508, length 0
18:52:42.684822 IP lamp-ubuntu-s-1vcpu-1gb-tor1-01.ssh > 198.96.87.225.57001: Flags [P.], seq 41588:41880, ack 1, win 501, length 292
18:52:42.745035 IP 198.96.87.225.57001 > lamp-ubuntu-s-1vcpu-1gb-tor1-01.ssh: Flags [.], ack 41880, win 512, length 0
18:52:42.788734 IP lamp-ubuntu-s-1vcpu-1gb-tor1-01.ssh > 198.96.87.225.57001: Flags [P.], seq 41880:42172, ack 1, win 501, length 292
18:52:42.837570 IP 198.96.87.225.57001 > lamp-ubuntu-s-1vcpu-1gb-tor1-01.ssh: Flags [.], ack 42172, win 511, length 0
18:52:42.892774 IP lamp-ubuntu-s-1vcpu-1gb-tor1-01.ssh > 198.96.87.225.57001: Flags [P.], seq 42172:42464, ack 1, win 501, length 292
18:52:42.947325 IP 198.96.87.225.57001 > lamp-ubuntu-s-1vcpu-1gb-tor1-01.ssh: Flags [.], ack 42464, win 510, length 0
18:52:42.996780 IP lamp-ubuntu-s-1vcpu-1gb-tor1-01.ssh > 198.96.87.225.57001: Flags [P.], seq 42464:42756, ack 1, win 501, length 292
18:52:43.039560 IP 198.96.87.225.57001 > lamp-ubuntu-s-1vcpu-1gb-tor1-01.ssh: Flags [.], ack 42756, win 509, length 0
18:52:43.100700 IP lamp-ubuntu-s-1vcpu-1gb-tor1-01.ssh > 198.96.87.225.57001: Flags [P.], seq 42756:43048, ack 1, win 501, length 292
18:52:43.148032 IP 198.96.87.225.57001 > lamp-ubuntu-s-1vcpu-1gb-tor1-01.ssh: Flags [.], ack 43048, win 508, length 0
18:52:43.204640 IP lamp-ubuntu-s-1vcpu-1gb-tor1-01.ssh > 198.96.87.225.57001: Flags [P.], seq 43048:43340, ack 1, win 501, length 292
18:52:43.229953 IP lamp-ubuntu-s-1vcpu-1gb-tor1-01.ssh > 175.215.143.90.33062: Flags [P.], seq 81:161, ack 192, win 501, options [nop,nop,TS val 2229435412 ecr 2000376498], length 80
18:52:43.256672 IP 198.96.87.225.57001 > lamp-ubuntu-s-1vcpu-1gb-tor1-01.ssh: Flags [.], ack 43340, win 512, length 0
18:52:43.308702 IP lamp-ubuntu-s-1vcpu-1gb-tor1-01.ssh > 198.96.87.225.57001: Flags [P.], seq 43340:43816, ack 1, win 501, length 476
18:52:43.362952 IP 198.96.87.225.57001 > lamp-ubuntu-s-1vcpu-1gb-tor1-01.ssh: Flags [.], ack 43816, win 510, length 0
18:52:43.412733 IP lamp-ubuntu-s-1vcpu-1gb-tor1-01.ssh > 198.96.87.225.57001: Flags [P.], seq 43816:44108, ack 1, win 501, length 292
18:52:43.471402 IP 198.96.87.225.57001 > lamp-ubuntu-s-1vcpu-1gb-tor1-01.ssh: Flags [.], ack 44108, win 509, length 0
18:52:43.516765 IP lamp-ubuntu-s-1vcpu-1gb-tor1-01.ssh > 198.96.87.225.57001: Flags [P.], seq 44108:44400, ack 1, win 501, length 292
18:52:43.564281 IP 198.96.87.225.57001 > lamp-ubuntu-s-1vcpu-1gb-tor1-01.ssh: Flags [.], ack 44400, win 508, length 0
18:52:43.584162 IP 175.215.143.90.33062 > lamp-ubuntu-s-1vcpu-1gb-tor1-01.ssh: Flags [P.], seq 192:288, ack 161, win 1073, options [nop,nop,TS val 2000379468 ecr 2229435412], length 96
18:52:43.584227 IP lamp-ubuntu-s-1vcpu-1gb-tor1-01.ssh > 175.215.143.90.33062: Flags [.], ack 288, win 501, options [nop,nop,TS val 2229435766 ecr 2000379468], length 0
18:52:43.620785 IP lamp-ubuntu-s-1vcpu-1gb-tor1-01.ssh > 198.96.87.225.57001: Flags [P.], seq 44400:45044, ack 1, win 501, length 644
18:52:43.627540 IP 198.96.87.225.57001 > lamp-ubuntu-s-1vcpu-1gb-tor1-01.ssh: Flags [P.], seq 1:37, ack 45044, win 512, length 36
18:52:43.668536 IP lamp-ubuntu-s-1vcpu-1gb-tor1-01.ssh > 198.96.87.225.57001: Flags [.], ack 37, win 501, length 0
18:52:43.724755 IP lamp-ubuntu-s-1vcpu-1gb-tor1-01.ssh > 198.96.87.225.57001: Flags [P.], seq 45044:45464, ack 37, win 501, length 420
18:52:43.781934 IP 198.96.87.225.57001 > lamp-ubuntu-s-1vcpu-1gb-tor1-01.ssh: Flags [.], ack 45464, win 511, length 0
18:52:43.828736 IP lamp-ubuntu-s-1vcpu-1gb-tor1-01.ssh > 198.96.87.225.57001: Flags [P.], seq 45464:45756, ack 37, win 501, length 292
18:52:43.932711 IP lamp-ubuntu-s-1vcpu-1gb-tor1-01.ssh > 198.96.87.225.57001: Flags [P.], seq 45756:45928, ack 37, win 501, length 172
18:52:43.938067 IP 198.96.87.225.57001 > lamp-ubuntu-s-1vcpu-1gb-tor1-01.ssh: Flags [.], ack 45464, win 511, options [nop,nop,sack 1 {45756:45928}], length 0
18:52:43.938120 IP lamp-ubuntu-s-1vcpu-1gb-tor1-01.ssh > 198.96.87.225.57001: Flags [P.], seq 45464:45756, ack 37, win 501, length 292
18:52:43.941172 IP 198.96.87.225.57001 > lamp-ubuntu-s-1vcpu-1gb-tor1-01.ssh: Flags [.], ack 45928, win 509, length 0
18:52:44.036819 IP lamp-ubuntu-s-1vcpu-1gb-tor1-01.ssh > 198.96.87.225.57001: Flags [P.], seq 45928:46516, ack 37, win 501, length 588
18:52:44.090792 IP 198.96.87.225.57001 > lamp-ubuntu-s-1vcpu-1gb-tor1-01.ssh: Flags [.], ack 46516, win 512, length 0
18:52:44.140707 IP lamp-ubuntu-s-1vcpu-1gb-tor1-01.ssh > 198.96.87.225.57001: Flags [P.], seq 46516:46808, ack 37, win 501, length 292
18:52:44.199700 IP 198.96.87.225.57001 > lamp-ubuntu-s-1vcpu-1gb-tor1-01.ssh: Flags [.], ack 46808, win 511, length 0
18:52:44.244705 IP lamp-ubuntu-s-1vcpu-1gb-tor1-01.ssh > 198.96.87.225.57001: Flags [P.], seq 46808:47100, ack 37, win 501, length 292
18:52:44.291768 IP 198.96.87.225.57001 > lamp-ubuntu-s-1vcpu-1gb-tor1-01.ssh: Flags [.], ack 47100, win 510, length 0
18:52:44.348771 IP lamp-ubuntu-s-1vcpu-1gb-tor1-01.ssh > 198.96.87.225.57001: Flags [P.], seq 47100:47392, ack 37, win 501, length 292
18:52:44.402264 IP 198.96.87.225.57001 > lamp-ubuntu-s-1vcpu-1gb-tor1-01.ssh: Flags [.], ack 47392, win 509, length 0
18:52:44.452679 IP lamp-ubuntu-s-1vcpu-1gb-tor1-01.ssh > 198.96.87.225.57001: Flags [P.], seq 47392:47684, ack 37, win 501, length 292
18:52:44.509906 IP 198.96.87.225.57001 > lamp-ubuntu-s-1vcpu-1gb-tor1-01.ssh: Flags [.], ack 47684, win 508, length 0
18:52:44.556734 IP lamp-ubuntu-s-1vcpu-1gb-tor1-01.ssh > 198.96.87.225.57001: Flags [P.], seq 47684:47976, ack 37, win 501, length 292
18:52:44.618793 IP 198.96.87.225.57001 > lamp-ubuntu-s-1vcpu-1gb-tor1-01.ssh: Flags [.], ack 47976, win 512, length 0
18:52:44.660754 IP lamp-ubuntu-s-1vcpu-1gb-tor1-01.ssh > 198.96.87.225.57001: Flags [P.], seq 47976:48268, ack 37, win 501, length 292
18:52:44.712439 IP 198.96.87.225.57001 > lamp-ubuntu-s-1vcpu-1gb-tor1-01.ssh: Flags [.], ack 48268, win 511, length 0
18:52:44.764748 IP lamp-ubuntu-s-1vcpu-1gb-tor1-01.ssh > 198.96.87.225.57001: Flags [P.], seq 48268:48560, ack 37, win 501, length 292
18:52:44.822992 IP 198.96.87.225.57001 > lamp-ubuntu-s-1vcpu-1gb-tor1-01.ssh: Flags [.], ack 48560, win 510, length 0
18:52:44.868751 IP lamp-ubuntu-s-1vcpu-1gb-tor1-01.ssh > 198.96.87.225.57001: Flags [P.], seq 48560:48852, ack 37, win 501, length 292
18:52:44.916055 IP 198.96.87.225.57001 > lamp-ubuntu-s-1vcpu-1gb-tor1-01.ssh: Flags [.], ack 48852, win 509, length 0
18:52:44.972716 IP lamp-ubuntu-s-1vcpu-1gb-tor1-01.ssh > 198.96.87.225.57001: Flags [P.], seq 48852:49144, ack 37, win 501, length 292
18:52:45.025440 IP 198.96.87.225.57001 > lamp-ubuntu-s-1vcpu-1gb-tor1-01.ssh: Flags [.], ack 49144, win 508, length 0
18:52:45.076694 IP lamp-ubuntu-s-1vcpu-1gb-tor1-01.ssh > 198.96.87.225.57001: Flags [P.], seq 49144:49436, ack 37, win 501, length 292
18:52:45.132203 IP 198.96.87.225.57001 > lamp-ubuntu-s-1vcpu-1gb-tor1-01.ssh: Flags [.], ack 49436, win 512, length 0
